{
  "schema_version": 1,
  "product_id": "template-delivery-pdf-checker",
  "name": "Template Delivery PDF Checker",
  "summary": "Check a template delivery PDF for missing, duplicate, malformed, and risky Canva links before a buyer receives it.",
  "customer": "Solo Etsy or Gumroad sellers who deliver editable Canva templates through downloadable PDF files.",
  "problem": "A delivery PDF can look correct while containing no clickable link, a duplicated or malformed target, or a Canva view/edit link that exposes the seller's master instead of opening a buyer-safe template flow.",
  "solution": "A downloadable offline browser utility that reads PDF link annotations locally, classifies Canva and external targets, overlays every clickable region, surfaces warnings, and exports a QA report.",
  "distribution": {
    "format": "download",
    "channel": "manual"
  },
  "pricing": {
    "currency": "USD",
    "amount_cents": 1200
  },
  "state": "BUILDING",
  "source_issue": 3,
  "artifacts": [
    "products/template-delivery-pdf-checker/README.md",
    "products/template-delivery-pdf-checker/dist/index.html",
    "products/template-delivery-pdf-checker/dist/app.js",
    "products/template-delivery-pdf-checker/dist/styles.css",
    "products/template-delivery-pdf-checker/dist/README.txt",
    "products/template-delivery-pdf-checker/dist/THIRD_PARTY_NOTICES.txt",
    "products/template-delivery-pdf-checker/release/template-delivery-pdf-checker-v1.0.0.zip"
  ],
  "acceptance_checks": [
    {
      "id": "classify-fixture-links",
      "description": "A three-link fixture produces exactly three rows with correct pages, URLs, and categories.",
      "required": true,
      "status": "passed"
    },
    {
      "id": "warn-broken-links",
      "description": "The utility warns for zero annotations, non-HTTPS or malformed targets, duplicates, and risky Canva links.",
      "required": true,
      "status": "passed"
    },
    {
      "id": "overlay-detected-rectangles",
      "description": "The preview exposes one visible overlay for every detected link rectangle on the selected page.",
      "required": true,
      "status": "passed"
    },
    {
      "id": "export-complete-report",
      "description": "Markdown and CSV exports include file metadata, category counts, rows, and all displayed warnings.",
      "required": true,
      "status": "passed"
    },
    {
      "id": "offline-local-processing",
      "description": "The built app loads and analyzes a fixture with the network disabled and makes no outbound request.",
      "required": true,
      "status": "passed"
    },
    {
      "id": "compatibility-security-corpus",
      "description": "An 18-profile annotation corpus plus a real Chrome print-to-PDF export covers URI encodings, Canva patterns, internal destinations, and active-content targets.",
      "required": true,
      "status": "passed"
    },
    {
      "id": "bounded-failure-handling",
      "description": "File, page, and link limits, cancellation, damaged PDFs, password errors, and parser failures produce bounded behavior and customer-facing messages.",
      "required": true,
      "status": "passed"
    },
    {
      "id": "browser-download-matrix",
      "description": "Chrome, Edge, Firefox, and WebKit load from file://, remain network-isolated, analyze the fixture, render overlays, and download verified Markdown and CSV reports.",
      "required": true,
      "status": "passed"
    },
    {
      "id": "release-security-integrity",
      "description": "The release ZIP contains only intended assets, disables PDF JavaScript evaluation, enforces a restrictive CSP, contains no source map, and stays below 10 MB.",
      "required": true,
      "status": "passed"
    },
    {
      "id": "github-ci",
      "description": "The product pull request passes the manifest validator and the product-specific clean install, unit/PDF/release, and Chromium browser jobs on GitHub Actions.",
      "required": true,
      "status": "pending"
    }
  ],
  "created_at": "2026-08-26T06:43:16Z",
  "updated_at": "2026-08-26T07:40:08Z"
}
